{
  "version": "1.0.0",
  "project_id": "synthetic-bgm-contract",
  "created_at": "2026-07-16T00:00:00.000Z",
  "mode": "suggest",
  "scoring_strategy": {
    "strategy_id": "bgm-score-v1",
    "base_total_points": 100,
    "auto_minimum_score": 78,
    "auto_minimum_margin": 12
  },
  "redistribution_trace": {
    "applied": true,
    "source_component": "semantic_fit",
    "source_weight": 30,
    "reason": "semantic channel unavailable",
    "allocations": [
      { "component": "editorial_family_arc_fit", "added_points": 9.2308 },
      { "component": "speech_friendliness", "added_points": 6.9231 },
      { "component": "energy_tempo_fit", "added_points": 6.9231 },
      { "component": "duration_edit_ending_fit", "added_points": 4.6154 },
      { "component": "beat_downbeat_confidence", "added_points": 2.3076 }
    ]
  },
  "input_hashes": {
    "creative_brief": "sha256:1111111111111111111111111111111111111111111111111111111111111111",
    "edit_blueprint": "sha256:2222222222222222222222222222222222222222222222222222222222222222",
    "timeline": "sha256:3333333333333333333333333333333333333333333333333333333333333333",
    "catalog": "sha256:4444444444444444444444444444444444444444444444444444444444444444",
    "analyses": [
      {
        "track_id": "synthetic-calm-low-01",
        "analysis_hash": "sha256:cccccccccccccccccccccccccccccccccccccccccccccccccccccccccccccccc"
      }
    ]
  },
  "requirements": {
    "families": ["Trust / Clarity"],
    "intensities": ["low"],
    "use_cases": ["interview"],
    "minimum_speech_friendliness": 0.8,
    "vocal_presence_allowed": ["none"],
    "duration_us": 60000000
  },
  "hard_constraints": [
    { "constraint_id": "licensed-preview", "kind": "rights", "value": "preview_internal" },
    { "constraint_id": "installed", "kind": "availability", "value": true }
  ],
  "candidates": [
    {
      "track_id": "synthetic-calm-low-01",
      "content_hash": "sha256:aaaaaaaaaaaaaaaaaaaaaaaaaaaaaaaaaaaaaaaaaaaaaaaaaaaaaaaaaaaaaaaa",
      "rank": 1,
      "status": "ranked",
      "total_score": 92,
      "score_breakdown": {
        "semantic_fit": 0,
        "editorial_family_arc_fit": 18,
        "speech_friendliness": 14,
        "energy_tempo_fit": 12,
        "duration_edit_ending_fit": 9,
        "beat_downbeat_confidence": 4,
        "diversity_recent_use": 5
      },
      "rejection_reasons": [],
      "explanation": "Sparse, warm arrangement matches a dialogue-led interview."
    },
    {
      "track_id": "synthetic-progress-high-01",
      "content_hash": "sha256:bbbbbbbbbbbbbbbbbbbbbbbbbbbbbbbbbbbbbbbbbbbbbbbbbbbbbbbbbbbbbbbb",
      "rank": null,
      "status": "rejected",
      "total_score": null,
      "score_breakdown": {
        "semantic_fit": 0,
        "editorial_family_arc_fit": 0,
        "speech_friendliness": 0,
        "energy_tempo_fit": 0,
        "duration_edit_ending_fit": 0,
        "beat_downbeat_confidence": 0,
        "diversity_recent_use": 0
      },
      "rejection_reasons": ["intensity exceeds requested range"],
      "explanation": "Rejected by the normalized intensity constraint."
    }
  ],
  "selected": {
    "track_id": "synthetic-calm-low-01",
    "content_hash": "sha256:aaaaaaaaaaaaaaaaaaaaaaaaaaaaaaaaaaaaaaaaaaaaaaaaaaaaaaaaaaaaaaaa",
    "rank": 1,
    "score": 92,
    "confidence": 0.86,
    "explanation": "Best speech compatibility and family match."
  },
  "top_two_margin": null,
  "operator_override": null,
  "semantic_channel": {
    "status": "unavailable",
    "model_revision": null,
    "warnings": ["metadata-only ranking"]
  },
  "usage_history_penalties": [
    { "track_id": "synthetic-calm-low-01", "usage_count_90d": 0, "penalty": 0 }
  ],
  "warnings": ["semantic channel unavailable; authored metadata used"]
}
